,name,date,speech,elected
4,Gerald R. Ford ,"November 01, 1976","['[Recorded October 30, 1976. Released November 1, 1976]', 'Tomorrow is a very crucial election. But tonight America is strong, America is free, America is on the move. But 2 years ago America was in deep trouble. When I became President, inflation was over 12 percent. We were on the brink of a serious recession, the worst in 40 years. There had been a loss of trust in the White House itself. We were still involved in Vietnam.', 'When I took the oath of office in August of 1974, I said I had not been elected by your ballots, but I asked that you confirm me by your prayers. Those prayers really helped.', 'In the meantime America has turned around. I put the ship of state on an even keel. I held a firm hand on the tiller for a steady course. Today we are doing much, much better. The rate of inflation has been cut by more than 50 percent. The job picture is getting better. We have added 4 million more jobs in the last 18 months. Eighty-eight million people are working today. We have restored confidence and trust in the White House itself, and America is at peace. Not a single young American is fighting or dying on any foreign soil tonight, and I will keep it that way for the next 4 years.', 'We have two major problems: One, to keep America strong, to meet the challenge of any adversary, to strengthen our alliances. And I pledge to you that the United States will remain number one. Our Army, Navy, Air Force, and Marines will be the best, as they are today. Some people have wanted to cut the defense budget. That would be a big gamble. I believe that the way to keep the peace is to keep strong, but in order to keep our domestic economy strong, we need additional tax reduction.', ""Last January I told the Congress they should cut your personal taxes. I think the best tax reform is tax reduction. I recommended that your personal exemption be increased from $750 to $1,000. Congress didn't do its job, but on January 3, when Congress comes back, I will have the tax reduction proposal on their desks so that they can give the middle-income taxpayer, who has been shortchanged, the kind of tax reduction that that group in our society so badly needs."", 'But, in addition, we have some other problems. We will do a better job in the next 4 years in making certain that the victims of crime are protected and that the criminal goes to jail. We will do a better job to help our older people, who have earned our respect and our support. We will do a better job in meeting some of the problems of our major metropolitan areas.', 'We have a lot of things to do, but we are in shape to do it now that we are over the hump of the tough last 2 years.', 'So, we come to the final round in this election. I want your prayers, as you gave them to me 2 years ago. But I would hope that you would confirm me this time by your ballots. I promise you, I pledge you, that I will not let you down.', 'Thank you, and good night.']",0
5,Gerald R. Ford ,"November 01, 1976","['Thank you very, very much, Governor Bill Milliken, Bob Griffin, Congressman Mary Esch, Lieutenant Governor Dammen and, of course, my wonderful wife, who I have just met at the Detroit airport, Betty Ford.', ""Let me take just a minute before saying something about the election. It is just great, of course, to be home in Michigan and to see some of the Michigan football greats--Ron Kramer, Bill Freehan--and Johnny Orr, the great basketball coach. But there are some other people that I would like to express my appreciation to, individuals who in their own business or their own area of talent have contributed significantly to this momentum that we have going. You have, I guess, been introduced to them: Hugh O'Brien, Wayne Rogers, they are great. Of course, when I came off the plane and Betty was at the stairs meeting me, there was the great Chuck Connors, and I thank Chuck, too."", 'But we have had some others who have traveled the length and the breadth of this country, because they believed in what I stood for: Peter Graves--you have known him from ""Mission: Impossible""--and then one of those fabulous people on television, also from sports, Joe Garagiola. He has been fighting for Jerry Ford for the last 10 days. Thank you.', ""I want to say two things to you: You are going to lose a great Congressman in Marv Esch, but he is going to be a great Senator, and you send him back to Washington, D.C. But you can't leave a void. You have got to have a good replacement, and I hope and trust that you will send Chuck Pursell to replace him."", ""I can't express deeply enough--I hope you will be quiet enough to hear a pin drop--between now and 8 o'clock tomorrow night, when the polls close in Michigan, you and millions like you in the great State of Michigan are going to help make a basic decision that could well turn the tide as to where this country goes in the next 4 years. And, yes, it could be a decision that would affect the next 100 years."", 'So, I ask you to listen to where I stand: I stand for lower taxes. I stand for more jobs. I stand for a balanced budget. I stand for less Federal spending. I stand for winning the battle against inflation. I stand for a clean environment. I stand for less crime. I stand for peace and liberty all over the world, and that is where we are today.', 'Let me phrase it this way: From your ranks I come, and with you I stand-and will--for the next 4 years.', ""In the last 2 years America has made incredible progress. In Kansas City I told the American people I would not concede a single vote, I would not concede a single State. I don't intend to concede Michigan. We are going to win it in Michigan."", 'And now, listen carefully. You may miss something. On the way over here from the airport, Betty and I had a little conference. We decided that all of you wonderful people had our personal invitation to come to the inauguration of Jerry Ford and Bob Dole on January 20.', 'There are many, many issues that I could discuss, but let me take just two. In the first debate my opponent said there would be a $60 billion surplus in the Federal Treasury. He made a commitment. He said if we have a $60 billion surplus, we are going to spend it on program after program after program. That is his point of view. You know what I said in that first debate? I said if there is a $60 billion surplus, I am going to give it back to the American people in a tax reduction.', 'On taxes--I believe the best tax reform is tax reduction. The middle-income taxpayer in America has been shortchanged, and we are going to change it in the next Congress. Jerry Ford is for the little taxpayer, and he is opposed to the big tax spender. On taxes--the last couple of days my opponent has said perhaps we can have a tax reduction. My opponent has said if, if, if, if we can have a tax reduction.', 'I will tell you where I stand. I have been consistent. I have been firm. The American people, the middle-class people, the middle-class taxpayers need tax relief, and they are going to get it under Jerry Ford. As a matter of fact--again, listen now, listen, because this affects you--last January, as Bob Griffin, Marv Esch, and all the other fine Members of Congress know, I recommended to the Congress that the Congress, in order to give equity and fairness to the middle-income taxpayer, we should increase the personal exemption from $750 to $1,000.', 'The other day I was walking through a plant, talking to people on the production line, and one of the men said, ""President Ford, what will you do for me and my family?"" I said, ""Well, how many kids you got?"" He said three. I said, ""You got a wife?"" He said, ""Sure, and I love her."" Then I said, ""All right."" I said, ""If the Congress had been responsible in the last session and done what I recommended they do, you, next April, when you made out that income tax return, could have taken $1,250 more in personal exemption, and you could have spent it instead of having some bureaucrat spend it out of Washington, D.C.""', ""Listen to this--you are a great audience, I love you--when Congress reconvenes next January 3, I am going to have that tax reduction proposal on their desk. Now, if they don't pass it in 1977, we will have it on their desk in 1978. But if they don't pass it in 1978, you and I are going to go out and beat them in the 1978 election."", ""Let's talk about one other big issue. I am the first President--and I am proud to say it--who can stand before the American people since Dwight D. Eisenhower and say America is at peace. But we are at peace in America because America is strong. Our Army, our Navy, our Air Force, our Marines are number one, and we are going to keep them number one."", ""Now, my opponent, he wants to cut the defense budget by $5 billion or maybe $15 billion. Let me tell you, that is too big a gamble for the security of the United States, and President Ford won't take that gamble. One of the greatest accomplishments of this administration is that because we are strong, strong internally and strong externally, there is not a single young American fighting or dying on any foreign soil tonight, and we are going to keep it that way."", 'On August 9, 1974, I stood in the East Room of the White House and took the oath of office. Betty held the Bible. After that was over and as I \'realized the troubled times we were in--with inflation over 12 percent, with America still involved in Vietnam, with us on the brink of the worst recession in 40 years, and trust and confidence in the White House gone--I made a few remarks to the American people. I said, among other things, ""I know that you have not confirmed me by your ballots, but I ask you to confirm me by your prayers.""', 'In those 2 tough years since August 9, we have made incredible progress in this great country. Reflect for a minute on our 200th birthday. It was a great occasion, where all over America we found that there was a new togetherness. We could disagree without being disagreeable. We could move forward as we have, shoulder to shoulder and arm in arm. That spirit is infectious, and America is on the move. I thought then--as I did on August 9--how wonderful the people of Michigan have been to give me the chance to serve not only Michigan but to serve the people of 50 States. Everything I have in politics comes from you, and I express my deepest appreciation and gratitude.', 'But now we have that crucial decision to make. America is respected. Some of you may have seen those ""Tall Ships"" in the harbor of New York. Ship after ship, from country after country, had come to pay respect to the greatest country in the history of mankind, the United States of America.', 'Now, between right this minute and 8 tomorrow night, you have that critical decision to make. Tomorrow, yes, you can confirm me by your prayers--and your prayers truly help--but now you have the opportunity to confirm me with your ballots. I ask for your support, and I promise you from the bottom of my heart I will not let you down.', 'Thank you very much.']",0
6,Gerald R. Ford ,"November 01, 1976","['Would you please be very quiet for just a minute? I would hope that we might even hear a pin drop.', ""I don't think that I can adequately express in words tonight Betty's appreciation and mine for this tremendous welcome to the home that we love so much, Grand Rapids."", 'I have made a lot of speeches, and this is the hardest one to make, because as I look out in this audience and as I saw so many people as we came down Monroe Avenue--Democrats, Independents, Republicans--people that Betty and I lived with, that Betty and I love, that I tried to help over the years when I had the honor of representing this great congressional district, I could tell you some stories about how the tough problems came to our office. And we never asked the person that walked in that office whether he or she was a Democrat or a Republican. We said, what can we do to help you, and that is the way I want to be your President.', 'You know, those wonderful experiences over a period of time, of taking that trailer down through Ottawa County, Ionia County, Kent County, and sitting and listening to wonderful people who had a problem, who wanted to give me a little trouble, give me a hard time--and they did--but also we had a couple of friends that might come in and say nice things about us. But the wonderful experience of representing the Fifth Congressional District will be something that I will never forget, and I thank you for the opportunity.', 'You know, I had a speech I was going to make, but I threw it away. [Laughter]', 'But I have got a couple of friends that I would like to introduce to you and to suggest that you can help me if you help them. First, I would like to recommend, because I know him, because I know the job he has done in Congress, I would like to recommend to you that you vote tomorrow for Mary Esch for the United States Senate. Then I would equally say it would be very helpful to me as your next President if you would send Hal Sawyer to represent you here in the Fifth District.', 'As we came off the expressway, we went down College Avenue and Betty said, ""I went to Fountain School."" We went right by it. Then we went by Central High School, but then, you know, I said to her, ""Well, South High, that was a great school, too."" [Laughter]', 'But anyhow, Grand Rapids, Kent County, Ottawa County, Ionia, well, all of them--western Michigan can make the difference and this is what I want you to know and what I think it is all about tomorrow.', 'You know, on August 9, 1974, I was sworn in as your President. You know better than anybody in this country, I never sought the office, but circumstances put me in the position where I stood in the East Room of the White House. Betty held the Bible open; I put my hand on it. I took the oath of office at a tough time, when there had been a great loss of trust in the White House itself. We had high inflation. We were on the brink of a recession. We were still involved in Vietnam. But with some apprehension I walked over to the Oval Office. But before doing so, I said to all Americans, not just to you from here, that you had not elected me by your ballots, but I prayed that you would confirm me with your prayers. And you did.', ""We went through troubled times for the last 2 years. But because you stood with me, because you prayed with me, because you believed in America, because you had strength and faith--and 215 million other Americans--we have turned things around, and we see brighter skies, and we see greater opportunity. We see, as we saw on July 4, when there was a great spirit that was expressed in America, our 200th birthday, all of a sudden, Americans--Democrats, Independents, and Republicans--came to the conclusion that we not only could read history--and it was a great history--but more importantly, together, regardless of our political persuasion, we could write history for the third century of America's great history, and we will."", ""It is so nice to be back here where I see Bill Milliken, I see Bob Griffin, I see Bob VanderLaan,1 I see all the people that I grew up with, that Betty grew up with. You know, it is hard to express one's deep sentiments about a community and an area that has been so good to us."", 'So, as I conclude these totally prepared remarks--[laughter]--tomorrow each and every one of you have a great decision to make. I suspect it might be the right one.', 'Let me conclude with just this final comment: Betty and I have been honored to represent this part of the country--but all America--in the White House during the last 2 years, and they have been troubled, and they have been tough. But we kept the ship of state on the right course, and I tried to keep a firm, commonsense hand at the tiller. And the net result is, things have turned around. America has made incredible progress in the last 2 years. But we are just moving. We are going to get better. We are going to make America what our forefathers said it would be.', ""When I was sworn in, I asked for your prayers. I said you hadn't elected me. But tomorrow all of you in this great area of western Michigan can really decide the election. You can decide the election in Michigan."", ""In Kansas City I said I wouldn't concede a single vote, I wouldn't concede a single State--and I don't concede Michigan to the opposition. Western Michigan can turn the tide. Western Michigan can decide the fate of the next 4 years in this country. It will make the difference in Michigan. It will make the difference in the election."", ""And so, I say to you calmly, from the depth of my appreciation: Tomorrow, yes, I want your prayers for confirmation, but tomorrow I ask that you confirm me with your votes, and I won't let you down. I promise that."", 'Thank you.']",0
7,Gerald R. Ford ,"November 02, 1976","[""In these last hours I'd like to share with you some personal thoughts about today's election. To all of us, the outcome is important, because the choice is final."", ""I believe I offer experienced leadership; you will have to decide whether my opponent can make the same claim. I think my approach could properly be called steady and dependable; it is my opinion that, even as I speak to you, his claims are unclear and untested. To single out just one issue, my course promises a lid on spending and a tax cut for every American family; Mr. Carter's approach shifts with the wind, leaving me with the feeling that we, the American people, could be left high and dry."", 'To stay on our steady and dependable course, I need your help; I need your vote. To me it is more than a choice between different approaches to government; it is the test of our political system, a test of the qualities we Americans seek in our leadership.', ""For these past 2 years I have been careful never to promise what I could not deliver. It has been my goal to inspire your confidence in America through solid performance rather than through mere words. And in these past 2 years I think America has come a long way back: We're at peace in our world, we have peace of mind here at home, inflation has been cut in half, we've set a peacetime record of 4 million new jobs in 17 months, and honor has been restored to the White House. I'm proud of that extraordinary comeback, and I think America should be too. You all did it. And I think we can be proud."", 'So now that our comeback has brought us to the threshold of a better quality of life, the choice is yours to make. I hope you will choose continued leadership. This is my fondest hope: to continue to serve the people of this country that has blessed me in so many ways.', 'The White House has affected every person ever to serve in it. Many have added to its wisdom. Some have succumbed to its power. Most have risen to its challenge. In my own case perhaps it is the unique conditions of my service that have most influenced my thoughts. Perhaps only one who came to the Presidency without being elected can care as deeply as I do to use that power without ever abusing your trust. Perhaps only one who has served as your President without your mandate can desire as strongly as I do to serve as your President with your mandate.', 'This election comes at the end of our second century and also at the beginning of what can be a new generation of freedom where individual Americans can know the blessings of freedom without the intrusions of a government trying to be all things to all people.']",0
8,Gerald R. Ford ,"November 03, 1976","[""It is perfectly obvious that my voice isn't up to par, and I shouldn't be making very many comments, and I won't. But I did want Betty, Mike, Jack, Steve, Susan, and Gayle to come down with me and to listen while Betty read a statement that I have sent to Governor Carter. I guess Ron1 has told you that I called him."", 'But I do want to express on a personal basis my appreciation and that of my family for the friendship that all of us have had. And after Betty reads the statement that was sent to Governor Carter by me, I think all of us--Betty, the children, and myself--would like to just come down and shake hands and express our appreciation personally.', 'Let me call on the real spokesman for the family. Betty.', 'Mrs. Ford. The President asked me to tell you that he telephoned President elect Carter a short time ago and congratulated him on his victory.', ""The President also wants to thank all those thousands of people who worked so hard on his behalf and the millions who supported him with their votes. It has been the greatest honor of my husband's life to have served his fellow Americans during 2 of the most difficult years in our history."", 'The President urges all Americans to join him in giving your united support to President-elect Carter as he prepares to assume his new responsibilities.', 'I would like to read you the telegram the President sent to President-elect Carter this morning.', '[At this point, Mrs. Ford read the telegram, the text of which follows:]', 'Dear Jimmy:\n', 'It is apparent now that you have won our long and intense struggle for the Presidency. I congratulate you on your victory.', 'As one who has been honored to serve the people of this great land, both in Congress and as President, I believe that we must now put the divisions of the campaign behind us and unite the country once again in the common pursuit of peace and prosperity.', 'Although there will continue to be disagreements over the best means to use in pursuing our goals, I want to assure you that you will have my complete and wholehearted support as you take the oath of office this January.', 'I also pledge to you that I, and all members of my Administration, will do all that we can to insure that you begin your term as smoothly and as effectively as possible.', 'May God bless you and your family as you undertake your new responsibilities.', 'Signed, ""Jerry Ford.""', 'Thank you very much.']",0
