,name,date,speech,elected
0,Gerald R. Ford ,"November 01, 1976","['We are nearly at the end of a long campaign. As I have moved about our country during the past few weeks, many people have told me, ""Mr. President, we know where you stand on jobs, and we think you are right. We know where you stand on inflation, and we agree with you. We know where you stand on foreign policy, and we agree with you there, too. But we are not quite sure what it all adds up to. We are not quite clear where you are aiming to lead America.""', 'So today, I want to talk with you about my concerns and my hopes for America as we enter our third century.', 'My vision of America is a nation that is strong and good, a nation that feels the need for constant improvement, a nation whose people care about each other and want to retain their own special sense of identity. Beyond that--a nation in which basic human rights are respected and maintained: the right to speak our minds; the right to choose the men and women who enact and enforce our laws; the right to stand equal before the law, regardless of sex, race, or religion; the right to bargain freely in the economic marketplace; the right to worship as we choose.', ""We have been through a lot in recent years--a war, a recession, runaway inflation, riots, scandals--a collection of troubles that shook America's confidence and left our people exhausted. In the past 2 years, I have done my best to put America back on even keel, to chart a steady course for the future."", ""America has had its heart broken too many times when grand promises went unfulfilled. We have learned through painful experience that when those frustrations cannot be held inside any more, our society explodes in violence and fear. That is why it is so important that those who would lead this country be honest enough to promise only what they know they can deliver, to admit that some problems can't be solved by waving a magic wand, or creating still another government program, or even by changing an administration. The answer lies not in making government bigger, but in making it serve us better in assuming more responsibilities for ourselves."", 'This Nation was not built on comfort, but on sacrifice; not on a maze of government programs, but on the strength and vitality of a free, self-reliant people.', 'We can improve the quality of life in America. We can improve education and health care. We can have comfortable, affordable homes in safe, decent neighborhoods. We can have clean air and water. We can create more parks and recreational facilities. We can care for those who need our help. We can keep America strong and at peace.', ""These are all worthy goals, and the government can help reach them all. But the government can't do everything. If it tries to do too much, it ends up doing nothing very well. If it assumes too much power and control, we will have sown the seeds of our own destruction as a free people. I would never let government grow so big or so strong that it can take away our freedom. I would not allow our people to grow so dependent on government that they would lose the incentive to develop their own creativity, generosity, and initiative. When a government solution is needed, I would make government respond at the level closest to the problem."", 'That is my vision of America: a vision of limited government and unlimited opportunity; a commitment to common sense and common progress.', ""On July 4, we celebrated the first 200 years of America's history. On November 2, with your help, we will begin a new generation of freedom for all Americans.""]",0
1,Gerald R. Ford ,"November 01, 1976","['Gee, it is nice to be back. It is nice to be back in Michigan.', 'Within hours after I received the nomination in Kansas City, I told Betty that I would open this campaign at home. It is the best way that I could say to my friends and the citizens of my home State, thank you. Thank you for all that you have done for me the past 28 years.', 'I said in my acceptance speech, the speech to the American people, it is from your ranks that I come and on your side that I stand. There is no place on the Earth where that statement is more true than among all of you here in Michigan today.', 'I am the first son of Michigan to serve as President of the United States. I am part of this great State, its people, and its belief in America. You first sent me to Congress 28 years ago, and in those 28 years my deep feelings for Michigan have matured into a total loyalty as well as a deep love.', 'I come to you now to seek your support for my election to the highest office in the land. I know you will support me as you always have. May I tell you how important that really is? Someone once said you can tell a lot about a man by the way his family feels about him. Michigan is my family.', 'From the kids--Mike, Jack, Steve, Susan--from Betty and of course from myself, thanks from the bottom of my heart, for your wonderful support, your continued prayers, and your belief in Jerry Ford.', 'Thank you very much.']",0
2,Gerald R. Ford ,"November 01, 1976","['Let me ask you to be very quiet for just a few minutes, because the issues and decisions you make between now and tomorrow when the polls close are very, very crucial for America.', ""First, I want to thank your great Governor, Jim Rhodes, who has been with President Ford from the very beginning. Jim, I can't express deeply enough my gratitude and appreciation for your loyalty. But let me add this one feature. We have on the stage with me today the two greatest Governors in the history of Ohio."", 'But it is great to be in Akron, Canton, Massillon, and Alliance. What an area in the great State of Ohio.', ""I am honored to be on the team in Ohio with Bob Taft. Send him back to Washington for your good and for the country's good. Bob, you have got to win. And then you have your own Congressman in this area. He has done a super job, a fantastic job on your behalf, but a job for America. Send Ralph Regula back to help us."", 'And now let me speak straight from the shoulder. You have a chance to improve the quality of Congress by sending one of your own, Jim Houston, down to the House of Representatives.', ""But it is great to be here with Mayor Ballard, with Mayor Cmich.1 And then I want to thank somebody else who has taken time, along with others of equal prominence. Wayne,2 thank you very, very much. All over the country we have had outstanding people like Wayne participate voluntarily. We have had Peter Graves, Hugh O'Brien, Rod McKuen. We have had quality people who on their own have come out and said it is important for America that President Ford win. Wayne, I thank you very much."", 'Now there is one fellow that came down here along with his beautiful wife, and I want to thank Bill Stanton. Send Bill back to Congress.', 'But I mentioned a moment ago when I was speaking about your great Governor--and I said there were two great Governors on the platform this morning. And now it is my privilege to introduce to you a man who was a judge in Cleveland, a mayor of Cleveland, a Governor of Ohio, and an outstanding United States Senator, Frank Lausche.', ""You know I come from that State up north, but since 1963 I have been in the State of Ohio 56 times. That's not a bad record. I have been down to Canton on three occasions to the Football Hall of Fame, the football center of the United States. I never made it as a participant, but I respect and admire those outstanding men who have given us a great American sport. Congratulations, Jim."", 'With the help of Bob Taft, Ralph Regula, Bill Stanton, they got through the Cuyahoga National Park, the first national park in the history of the State of Ohio, and I was honored and pleased to sign that legislation.', 'As I said a moment ago, this is a crucial election. It will determine the course of events of this country, not only for the next 4 years but maybe, undoubtedly as I see it, the next century, our third century of American history. You know where I stand. I stand for lower taxes, a balanced budget, lower Federal spending, beating inflation, and peace and liberty for the United States of America. And in the last 2 years America has made incredible progress, and we are on our way, and we are going to make more in the next 4 years under Jerry Ford.', 'In Kansas City, I said we would not concede a single vote, we would not concede a single State. We want Ohio, and we are going to win Ohio.', 'And now let me extend a personal invitation from Betty and from me. We would love to have every one of you down to Inauguration Day on January 20, when Jerry Ford and Bob Dole are sworn in as President and Vice President.', 'There are many issues at stake in this election, but let me take two--one that means whether we have peace or a lack of security in this country; the other involves the health of our economy.', 'In the first debate, Mr. Carter said he would anticipate a $60 billion surplus in the Federal Treasury. He said that he would spend that $60 billion for a whole raft of new Federal programs. In that same debate, I said if there is a $60 billion surplus, I want a tax reduction for the American people.', 'President Ford is for the little taxpayer and President Ford is against the big tax spender. I have been firm; I have been consistent. The best tax reform is tax reduction. The middle-income taxpayer in this country--over 50 percent of us--have been shortchanged in the last 10 years by the actions of the Congress, and we are going to change it in the next session.', 'Mr. Carter, in the last 2 or 3 days, in discussing tax reduction, has said: Perhaps we will have a tax reduction--if we have a tax reduction. It is a clear distinction between him and President Ford. I have consistently, firmly, said the American people should and will have a tax reduction so we can stimulate the economy, so we can give you a better chance to spend that hard-earned cash that you deserve in your pocket and not in the Federal Treasury.', 'In January of this year, 1976, I submitted to the Congress a $28 billion tax reduction package. I said in order to do it honestly and conscientiously, the Congress had to go along with a $28 billion restraint in Federal spending. Included in my tax reduction proposal is the kind of tax reduction that is meaningful to the middle-income taxpayer. I recommended that we increase the personal exemption from $750--which it is today--to $1,000.', 'Let me tell you what that means. The other day I went through a plant and I was talking to some working men on a production line. And one of them said, ""President Ford, what does your tax reduction proposal mean to me and my family?"" I said, ""How many children do you have?"" He said, ""I have got three kids."" It turned out that he had himself, a wife, and three children. I said, ""Get out your pencil."" It means that if Congress had acted responsibly, we would have had for that man and millions and millions and millions of other taxpayers the opportunity next April to sit down and figure out in his case that he would have gotten $1,250 more in personal exemption, money that he could have spent for himself and his lovely family.', ""That's our tax proposal--tax reduction. And on January 3, when Congress reconvenes, they are going to have that tax reduction proposal on their desk, and if they don't pass it in 1977, we will send it right back up in 1978. And if that Congress doesn't pass it in 1978, you and I will go out and beat them in the next election in 1978."", 'But, there is another big difference. I am proud to stand before you and say that I am the first President since Dwight D. Eisenhower who can go to the American people to seek their support and say America is at peace. Under our administration--yours and mine--we have the finest Army, Navy, Air Force, and Marines, and we are going to keep them number one.', ""Mr. Carter wants to cut the defense budget by $5 to $15 billion. That is too big a gamble for America's security. And I want to pledge to you that in the next 4 years we are going to keep America number one so we can preserve the peace, deter aggression, meet any challenge. That is the kind of defense program I stand for and you stand for and America stands for."", 'On August 9, 1974, I stood in the East Room of the White House and took an oath of office to be your President. I had not sought this high office. Betty held the Bible, and I placed my hand on it and I said afterwards--because America was troubled, we were divided, there was anger, there was division-after having taken the oath of office, I said, ""I know that you have not elected me by your ballots. I ask you that you confirm me with your prayers.""', 'And with the help of your prayers in the last 2 years, we have gone from inflation of over 12 percent to under 6 percent. With your help and support, we have come out of the worst recession in 40 years. With your help, we have restored trust and confidence in the White House, because I can look each and every one of you in the eye and say I have been candid, straightforward.', 'But most of all, I can stand here with pride and say with your help and, yes, your prayers, America is at peace, not a single young American is fighting or dying on any foreign soil today, and we will keep it that way for the next 4 years.', ""But now we come to the crucial 24 hours. How many of you can remember, I'm sure, in either Canton or Akron or Alliance or Massilion that on July 4 you had a wonderful celebration in honor of our 200th birthday? Our forefathers gave us the greatest document for the governing of people in the history of mankind. Our forefathers have given us the kind of a government that is good for freedom and liberty."", ""We celebrated what they gave to us, but now--beginning tomorrow--we have an opportunity not only to read history but to make history. So, we come down to the bottom line. I know America is on the move. America has a new fresh look. We are together. We are united. So tomorrow, when you make that fateful decision, I ask you not only to confirm me with your prayers but I ask you to confirm me with your ballots. I won't let you down."", 'Thank you very much.']",0
3,Gerald R. Ford ,"November 01, 1976","['Thank you very, very much, Governor Jim Rhodes, Mayor Moody.', 'Let me express my deep appreciation to Congressman Sam Devine, Congressman Chalmers Wylie, Congressmen Clarence Brown, John Ashbrook, and Bill Harsha. I want you to make sure you elect them and reelect them for the benefit of Ohio and the United States.', 'But I want also, for the benefit of this great Buckeye State and for the benefit of our great country--you send Bob Taft back to Washington as your next United States Senator.', 'You know this all began right here, right in front of the Capitol, and local and State government is vital, and so I urge you--elect Bill Brown field to the State senate.', 'It is great to be in Columbus, the home of two of my good friends who represent excellence. First, Jack Nicklaus, a great supporter of mine--I thank him for that help and assistance. And then, also, one of my best friends, the kind of a person who represents excellence not only in coaching but excellence in character. He believes in winning, and that is what we are going to do. Thank you very much, Woody Hayes.1', ""You know, I come from that State up north. [Laughter] But since 1963 I have visited the Buckeye State 56 times, and I love you. I had the honor and the great privilege of speaking at a commencement at Ohio State in the fall of 1974--it was a great experience--but I have also come to Columbus and all of the other places. And you know what? Columbus likes to be, along with the great State of Ohio, on the side of a winner. So let's make it a home run, a touchdown tomorrow for the winning team, Jerry Ford and Bob Dole."", 'But there are several other people that I would like to recognize and indicate to them and to all of you my appreciation. First, we have on this platform one of the three greatest Governors in the State of Ohio, John Bricker.', 'And may I say, incidentally, from the appearance here of this great crowd and from the wonderful rally that we had in the Akron, Canton, Alliance, Massilion area earlier this morning, I am going to issue all of you an invitation. Betty and I want all of you to come down to that inauguration on January 20 when Jerry Ford and Bob Dole are sworn in as President and Vice President.', 'Now let me introduce to you, for some remarks, a person well known to you, who was a judge here in the State of Ohio and Cleveland, who was your Governor-and one of the three greatest Governors in the history of Ohio--who was a United States Senator. And now it is my privilege to introduce a close, personal friend whose support I really appreciate--your former Senator, your former Governor, Frank Lausche.', '[At this point, Frank Lausche announced his support of President Ford. The President then resumed speaking.]', ""An endorsement like that from one of Ohio's great, great citizens means a great deal to Jerry Ford, and I promise you, Frank, I won't let you down."", 'As we enter this critical last 24 hours--and this is one of the most critical elections in the history of the united States; it is the election that will set our course for the first 4 years of our third century--I want you to know where I stand. I stand for lower taxes, more jobs, a balanced budget, lower Federal spending, beating inflation, a clean environment, peace and liberty for the United States of America. From your ranks I come, and with you I stand.', 'In the last 2 years our great country, faced with adversity, has made an incredible comeback. When I spoke to you and to the American people in Kansas City, I said I would not concede a single vote, I would not concede a single State.', ""Ohio is going to be on the right side. We are counting on that Buckeye State to be with us tomorrow. With our momentum, let's do it, a home run."", ""I love that enthusiasm and applause, but take just a minute--let's hear a pin drop--because I want to talk about some of these, or at least two of the critical issues where I strongly differ with my opponent."", 'First, taxes. In the first debate my opponent said that we could anticipate a $60 billion surplus in the Federal Treasury. He said in that debate that he would spend that $60 billion for more programs, piling one on top of another. In that debate I said if there is a $60 billion surplus, I think it ought to go for a tax reduction to the middle-income taxpayer.', 'I can stand here and say with good conscience that President Ford stands for the little taxpayer and President Ford is against the big tax spender. Within the last several days Mr. Carter has been pressed. Does he want a tax reduction or not? He says, if, perhaps. President Ford has been on the line, talking straight from the shoulder saying, yes, the middle-income taxpayer has been shortchanged.', ""I recommended to the Congress in January that we ought to have a $28 billion tax reduction along side of a $28 billion restraint on Federal spending-for every tax dollar in reduction, a dollar reduced in the rate of growth of Federal spending. The Congress gave you half a loaf. They didn't go along with my proposal to increase the personal exemption from $750 to $1,000."", 'Now let me tell you what that means. It means that the middle-income taxpayer--50 percent of those that pay our taxes--would get, and let me illustrate it with an incident that happened: I was in a factory the other day, down a production line, and one of the men said to me, ""President Ford, where do you stand on taxes?"" I told him how I wanted to increase the personal exemption. I said, ""How many children do you have?"" He said, ""I have got three."" I said, ""If you have a wife, three children, and yourself, if Congress had acted responsibly, next April when you made out that income tax return, you would have had, under President Ford\'s tax reduction program, $1,250 more in personal exemption for you to spend and not have in the Federal Treasury.""', ""Now Congress didn't do it. But on January 3, when that next Congress convenes--and I want all of this good Ohio delegation back there to help me-I will have on their desk a tax reduction proposal that will include the increase in the personal exemption; it will increase jobs incentive legislation to help industry expand, to modernize. And if that Congress doesn't pass it in 1977, they will have it on their desk in January of 1978, and if they don't give that kind of decent, equitable tax reduction in 1978, I will join every one of you trying to beat them in that election in 1978."", ""But now let's talk about defense. Today the United States, with our Army, Navy, Air Force, and Marines--we are number one. And under President Ford we are going to keep them number one. I have recommended appropriations so they will have the best weapons, the best leadership, the best training. That' is the way to keep the peace. And under President Ford, with the strength that we have, we will strengthen our alliances. We will be able to look our adversaries straight in the eye, and they will respect us."", ""But let me say, you make a great contribution in the city of Columbus, because in the recommendations that I made for a strong defense--and that is the way you keep the peace--that we have a B-1 bomber to replace those aging B-52's that are now 20 and 25 years old. If we don't get the B-1 bomber as an instrument of peace, the President in the next 5, the next 10 years, if we continue to rely on the B-52's, will be sending our young combat pilots to protect us in aircraft older than they are, and that is not going to happen under President Ford."", 'I am proud to stand before you and say that I am the first President since Dwight D. Eisenhower who can tell the American people that America is at peace. I am proud of the fact that not a single young American is fighting or dying on any foreign soil today. And we are at peace because the United States is strong. We are not at war because the United States is strong.', 'And let me say, wasn\'t it a great, great celebration on the Fourth of July when America celebrated its 200th birthday? I happened to have the privilege to fly over New York Harbor and see those ""Tall Ships"" coming in, representing many, many countries. And why did they come to the United States? Because they respect America. And we are proud of America, and we will continue to be proud of America.', 'But now as this great campaign comes to a conclusion, I have the feeling that we have reunited as a people. When I became President, people were angry, divided, disillusioned. I will never forget that day in the East Room of the White House when I put my hand on the Bible held by my wife, Betty, and took the oath of office when America was troubled.', 'Yes, we were in trouble. Inflation was over 12 percent. We were still involved in Vietnam. There was a loss of confidence in the White House itself. We were on the brink of the worst recession in 40 years. And after having taken the oath of office to be your President, I said, since you have not elected me by your ballots, I ask you to confirm me with your prayers.', 'With those prayers we put the ship of state on a steady keel. I had a firm, commonsense hand on the tiller, and we have made incredible progress in the last 2 years. We have cut inflation by better than 50 percent. We have added 4 million jobs; we have 88 million people working today, the most in the history of the United States. We are at peace, and we are going to keep the peace.', 'And I can say with pride to all of you and to my former colleagues in the Congress--Bob Taft, Sam Devine, Chalmers Wylie, Clarence Miller, Bud Brown, Bill Harsha, Willis Gradison--that we have restored that confidence in the White House. I have been open, candid, frank.', ""And now, as we come to the final quarter--in fact, the final minutes--of this great campaign, you have a critical decision to make tomorrow. It couldn't have been put better than the way Frank Lausche put it."", 'But let me add, I have been proud to be your President during troubled times. I want the opportunity to build on that firm foundation, to keep America moving.', ""Therefore, I ask when you go to the polls tomorrow that you not only confirm me with your prayers but you also confirm me with your ballots. And I won't let you down.""]",0
