,name,date,speech
6,Franklin D. Roosevelt ,"October 29, 1944","['My friends:', 'This being Sunday, the Governor, cooperating with me in keeping politics out of it, says that he is not even going to introduce me.', 'I have been here before, and it is a great comfort to come on a Sunday in a campaign year, because on Sundays my life is made much more comfortable by not having to think about politics. Unfortunately, I do have to think about the war, because every day, including Sundays, dispatches come to me, on the train even, to tell me of the progress of our boys in Europe and in the Pacific and in the Philippines. I cannot get rid of that.', 'Coming up through the State today, I have been looking out of the window, and I think there is a subject that is a good subject for Sunday, because I remember the line in the poem, ""Only God can make a tree."" And one of the things that people have to realize all over the United States, and I think especially in West Virginia—I don\'t see the trees I ought to see. That is something that we in this country have fallen down on. We have been using up natural resources that we ought to have replaced. I know we can\'t replace coal- it will be a long time before all the coal is gone—but trees constitute something that we can replace.', 'We have to think not just of an annual crop, not just something that we can eat the next year. We have to think of a longer crop, something that takes years to grow, but which in the long run is going to do more good for our children and for our grandchildren than if we leave the hills bare.', ""I remember a story, and it is taken out of Germany. There was a town there- I don't know what has happened in the last twenty years—but this is back when I used to be in grade school in Germany—and I used to bicycle. And we came to a town, and outside of it there was a great forest. And the interesting thing to me, as a boy even, was that the people in that town didn't have to pay taxes. They were supported by their own forest."", 'Way back in the time of Louis something of France—the French king was approaching this town with a large army. And the prince of the time asked the townspeople to come out to defend their principality, and he promised them that if they would keep the invader out of the town, out of the principality, he would give them the forest.', ""The burghers turned out. They repulsed the French king. And very soon the prince made good. He gave the forest to the town. And for over two hundred years that town in Germany had to pay no taxes. Everybody made money, because they had no taxes. In other words, it was a forest on an annual-yield basis. They cut down perhaps seventy percent of what they could get out of that year's mature crop. And every year they planted new trees. And every year the proceeds from that forest paid the equivalent of taxes."", 'Now that is true more and more in this country. There are more and more municipalities that are reforesting their watersheds, putting trees on the top of their hills, preventing the erosion of soil. They are not on a self-sustaining basis because it has only been started within the last ten or fifteen years. And yet while only God can make a tree, we have to do a little bit to help ourselves.', ""I think that all of us sort of look at our lives in terms of ourselves, and yet your children, your grandchildren, your great-grandchildren, your great-great-grandchildren- some of them will be living right around here, right around where the population is today. Perhaps the old house- perhaps a better, new house. And more and more we are going to think about those grandchildren and great-grandchildren. It doesn't amount to very much, this cost of planting trees, and yet the hillsides of West Virginia of our grandparents' day were much more wonderful than they are now. It's largely a deforested State. And I believe that from the point of view of the beauties of nature, from the point of view of all that trees can be, and from the point of view of your own grandchildren's pocketbooks, the small number of cents, the small number of dollars that go into reforestation are going to come back a thousandfold."", ""Up where I live, in the country on the Hudson River, my family had—when I was a boy—five or six hundred acres. It wasn't valuable land. And my own father, in the old days, would go in every year and cut the family needs in the way of timber."", 'When I was a small boy, I realized that there was waste going on; and when I went to the State Senate as a young man, somebody appointed me to the Conservation Committee. Some parts of upstate New York were being eroded, a lot of topsoil was running away, we were getting more floods than we had ever had in the old days.', 'And just as an experiment, I started planting a few acres each year on run-down land. I tried to pasture some skinny cows on it. And at the same time, I went into the old woods and cleaned out no-account trees, trees that were under grown or would never amount to anything, crooked trees, rotten trees.', 'Well, the answer was this. When the last war came on, the old woods had some perfectly splendid trees, because I had cleaned them out, cleaned out the poor stuff.', ""And during that war, I made four thousand dollars, just by cutting out the mature trees. And I kept on every year. And in the winter time, when the men weren't doing much, they cleaned them out. And the trees grew."", ""And a quarter of a century later, there came this war. I think I cooperated with the Almighty, because I think trees were made to grow. Oh yes, they are useful as mine timbers. I know that. But there are a lot of places in this State where there isn't any mine timber being cut out."", ""And in this war, back home, I cut last year—and this is not very Christian- over four thousand dollars' worth net of oak trees, to make into submarine chasers and landing craft and other implements of war. And I am doing it again this year."", 'And I hope that this use of wood is growing, for all kinds of modern inventions, plastics, and so forth. I hope that when I am able to cut some more trees, twenty or twenty-five years from now—it may not be I, it may be one of the boys—we will be able to use them at a profit, not for building mine chasers or landing craft, but for turning them into some humane use.', 'And I believe that in this country—not in this State only, but in a great many more- we in the next few years, when peace comes, will be able to devote more thought to making our country more useful—every acre of it.', 'I remember eight years ago, out in the West, we knew that there were great floods and a dry belt in there. We knew, also, that trees bring water and avoid floods. And so we started one of those ""crackpot"" things, for which I have been criticized, a thing called the shelter belt, to keep the high winds away, to hold the moisture in the soil. And the result is that a great success has been made of that shelter belt. Not much ran downhill and the farmers are getting more crops and better crops out there on the prairies in the lea of these rows of trees.', 'Forestry pays from the practical point of view. I have proved that. And so I hope to live long enough to see West Virginia with more trees in it. I hope to live to see the day when this generation will be thinking not just of themselves but also of the children and the grandchildren.', ""I had a happy day this morning in looking out at this wonderful scenery, but I couldn't take my eyes off those bare hilltops. I couldn't take my thoughts off the fact that this generation, and especially the previous generation, have been thinking of themselves and not of the future."", 'Some day I hope to come back, and I hope to see a great forestry program for the whole of the State. Nearly all of it needs it. I hope to come back and be able to say, ""I stopped, once upon a time, in Clarksburg, on a Sunday morning, and just avoided politics and talked to the people in Clarksburg, and they must have heard me all over the State, because they started planting trees.""', 'And so I think my Sunday sermon is just about over. It has been good to see you, and I really do hope that I will come back here, one of these days soon.', 'Thanks.']"
7,Franklin D. Roosevelt ,"November 04, 1944","[""This is not a formal campaign speech. It's just a visit from one neighbor to a lot of other neighbors, because, you know, from my place up on the Hudson River when I look east I can see into Connecticut, and it doesn't take me very much more than an hour to get down to Bridgeport from my house."", 'So let me just tell you as a neighbor that I am glad to be back.', 'This being war, though I am told not to mention that subject, I always remember back in 1917 or 1918 coming to Bridgeport when I was in the Navy Department, and seeing the building of ships, the manufacturing of munitions, guns, and bullets. And I remember very well the reputation that Bridgeport had in those days in the first war. And it has got the same reputation for a magnificent industrial effort and help to our troops in this war.', 'I hope that, while we are alive, Bridgeport will never be called On again to make munitions in a world war. And it is interesting, at this time, for the first time since the days of Lincoln, that we are conducting a war and carrying on a presidential election at the same time.', 'Some of us are trying to get excited about politics. Some of us become even rather agitated. You ought to know. Yes, there are a few politicians, even- men and women- who work themselves into such an emotional state that they say things I hope they will be sorry for before they die.', 'There isn\'t very much that I can say, except to talk about the record. You know that. A lot of people don\'t like me to talk about the record. They don\'t like to be reminded that people have been taken care of by the Congress through the passage of all kinds of social legislation. When I talk about those things again, some people say, ""Oh, why do they have to bring that subject up?""', ""I think we have made a pretty good record in running this war, and they don't like that talked about either. They like to talk about some kind of a wild, weird future. Well, believe me, you see it and then you don't see it. One candidate says one thing and in another place, simultaneously, another candidate says another thing. I get tremendously amused by some of this—not all of it—because I wish in a way I were back in 1910, when I was running for the State Senate in the State of New York, and I had a particularly disagreeable opponent, and he called me names. Well, I wasn't anything in those days- I wasn't President—and I answered him in kind. And the names that I called him were worse than the names that he called me. So we had a very joyous campaign."", ""In this campaign, of course, all things taken together, I can't talk about my opponent the way I would like to sometimes, because I try to think that I am a Christian. I try to think that some day I will go to Heaven, and I don't believe there is anything to be gained in saying dreadful things about other people in any campaign."", 'After next Tuesday there are going to be a lot of sorry people in the United States.', 'I want to say, looking into the future, that I hope some of my good friends who happen to be running for office—your candidate for Governor—your candidate for the Senate—both of them old friends of mine—will be elected; and I hope, too, that very soon after the first of January, Mrs. Roosevelt and I will have a call- in the White House—from the charming lady, Miss Connors [candidate for Congress against Clare Boothe Luce], on my right.', ""So it's good to see you all, and I'll be back some day, very soon I hope, as President."", 'Thanks.']"
8,Franklin D. Roosevelt ,"November 04, 1944","['I am glad to come back here. It\'s rather a happy surprise. Four years ago I was told terrible things were being circulated all over the country. People all over the United States were being told that if I got reelected, all of the Hartford insurance companies would go broke. So, coming in here, I expected to see vast, empty buildings not being used and employing no people. The insurance business was going to go flat. And yet they are still present. And, of course, the joke is that the insurance companies, not only of Hartford but of other places, are better off than they ever have been before. They are pretty good insurance companies, you know. They subscribe to the war loans. They have been patriotic. They just have only one unfortunate habit which they acquire every four years—in fact, the last few months of every four years. They say, ""If this man Roosevelt gets elected President, we will have to go out of business!"" So it is good to see them still going good to see that Hartford is not a city of empty homes.', ""But, you know, that was like a lot of other campaigns. Back in—what was it?— 1932, they said that grass was going to grow in the streets. But it didn't! And Mr. Hoover wasn't reelected President."", ""And then in 1936, some of the people all over the country-you know the kind I mean—tried to instill fear in the minds of the American people by saying that the social security funds of the United States were no good—they weren't safe. They even went to the extent of having some of their large financial backers put this type of scare material in the pay envelopes of millions of employees. And the interesting thing was that the employees didn't fall for it. They thought they knew better than the president of the company. And they took another chance with me."", 'Now, they will apparently never learn that this kind of campaign does not produce the results they look for. In fact, it usually produces the opposite result. It is going to do that again this year.', 'And they are making the fantastic claim this year that your Government is now engaged in some deep-dyed plot to take over the insurance business.', 'Well, it so happens that I have had some experience in the insurance business myself, and I know that the workers and managers in that business cannot be easily fooled by that type of propaganda.', 'Why, the insurance policies of the United States and your savings are safer than they ever were in the whole history of the United States—and so is the insurance business.', 'That was not true in 1933 when I took office. I don\'t have to recall to you the closing banks and the shaky insurance companies of those days. In fact, I think it is safe to say that a great many of the insurance companies in 1933, if they had tried to liquidate their assets for the benefit of policyholders, would have found themselves in the ""red."" They would not have had enough money. And the reason is obvious—because before 1933—a year before and the year before that—the value of the farms and mortgages and other properties on their books had depreciated so much that by March of 1933, they couldn\'t have been liquidated at anything like the figures at which they were carrying their assets on their own books. That\'s a pretty serious charge. But the record is there. Under the last Republican administration the insurance companies were ""bust.""', 'You know what happened in 1933. You know how quickly the action of this Administration resulted in increased earnings and savings and property values. And that is what this ""bungling, incompetent"" Administration has done for the people of the United States.', ""There is one thing that I have meant to say for the last two months, and haven't had a chance. It's a word about a group of our citizens that have been pretty hard hit by the war. They have not been able to earn the high level of wages that have been paid in shipyards and war factories—and yet, with amazing patience and fortitude they have continued in their essential jobs—carrying on as best they can. And those are the white-collar workers of America."", 'I think, however, that in addition to being thoroughly patriotic, staying at their work, they realize that this Administration has done a pretty good job in keeping down the cost of living-in protecting the purchasing power of their dollars in terms of rent and other necessities of life. Compared with the skyrocketing cost of living in the last war— twice as much of a rise as in this war- our record in this war, on the whole, has been very good. And I want you—as they used to say—t¢ give a hand to the white-collar workers of the United States.', ""Because during the war, for the first time in history, we have avoided wartime inflation. Inflation means nothing more than a rise in the cost of things, and the white-collar workers' wages haven't gone up anything like what the wages have gone up in other professions or trades."", 'The lesson of the last war was clear to us—nearly all of us—in the Administration, but to many Republicans it was not plain at all.', 'Time and again the Republicans in the Congress voted overwhelmingly against price control, and in favor of letting prices go skyrocketing.', 'So I make an assertion. The Democratic Party in this war has been the party of sound money. The Republican Party has been the party of unsound money.', 'If the Republicans had had their way, all of us—farmers, white-collar workers, factory workers, housewives—we would all have had our dollars cut by inflation and a higher cost of living.', 'I hope to come back here very often either as a private citizen, or as President of the United States. But I am very confident today that when I come back during the next four years it will be as President of the United States.', 'And in saying goodbye to you, after this very pleasing visit, I assure you that when I do come back, I will still be able to wear the same size hat.']"
9,Franklin D. Roosevelt ,"November 04, 1944","['I had hoped to be able to motor up here from Hartford, but I thought to myself that the gasoline would be of more use in a tank in Germany than in my car.', 'Somebody tells me that there is a political campaign on.', 'I think we all agree that it is probably one of the important political campaigns in our history.', 'But—here in Springfield—I cannot refrain from suggesting that there is also a war on- a war which, I very deeply believe, will decide the fate of our America and of the whole human race for generations to come.', 'You good people here in Springfield know a great deal about war. You have known about munitions for years, since long before I was born. You know about our preparedness, and you knew about it long before Pearl Harbor.', ""This city—located on one of the most beautiful rivers in the United States—it isn't quite so refined as the Hudson—this city has always been the center of experimentation and production of the weapons of defense against aggression."", 'The Springfield rifle—the Garand rifle—they have proved themselves, in one battle after another, essential weapons of war.', 'Here in Springfield, great history has been made. As your President during these eventful years, I am proud to be here and proud to be looking into the faces of all of you who did so much for America, and for the cause of civilization.', 'And also, I might add, because I have known publishers for a great many years- this city is the home of a great newspaper. And I wish that we had more papers throughout the Nation like the Springfield Republican.', 'It has been four years—four eventful, stirring years- since you people gave me the last mandate in an election. And here I am, back again.', 'For many American homes they have been years of personal heartbreak and tragedy, about which any words that I could say would be idle.', 'Yet, even for them- I would say, for them above all others there is the proud sense that America has come greatly through a dark and dangerous time. The ship of state is sturdy and safe, and with continued courage and wisdom we can bring it into a harbor where it will not be whipped by the storms of another war within any foreseeable period.', 'But—we are going to remain prepared. I take it as a matter of wisdom that we should not dismantle the Springfield arsenals. This time we are not going to scuttle our strength.', 'Four years ago many of us knew that this war might come. We sought to prepare America for it, often in the face of mocking gibes from those who said that we had nothing to fear from Germany or Japan.', 'We went about the work of building the national defenses and of setting up a system of selective service. We had the stern resolve—that I expressed many times four years ago- that we meant this for defense and not for offense—and that we would not send our boys to fight abroad unless we were attacked.', 'The attack came—treacherous, deadly attack.', 'Our pledge was kept. We fought back when we were attacked—obviously, rightly.', 'We fought back—as our forefathers had fought. We took the offensive—and we held it. The kind of America we inherited from our fathers is the kind of America we want to pass on to our children—but, an America more prosperous, more secure -free from want and free from fear.', 'It was to save that America that we joined in a common war against economic breakdown and depression- and we won that war.', 'It was to save that America that we joined in a common war against the Fascist ruthlessness and brutality of Germany and Japan. And we are winning that war.', 'It is to save that America that our sons are fighting gloriously on battlefields all over the world.', 'You and I have been through a lot together. And we are going to go ahead together- until we have finished this tremendous job of winning the war and building a strong, enduring peace.', 'So, sometimes I really honestly do forget politics. Regardless of what happens on election day—I assure you that I shall be the same man you have known all these years- and I am still dedicated to the same ideals for which you and I and our sons have been fighting.', 'I am very glad to have had this all too brief opportunity to be back here—I might almost say to chat with you.', 'I am glad to be back here in Springfield now, and I am coming back again. And being half from New England myself—up the river here in Northampton—I have a hunch—as lots of people do in western Massachusetts and eastern New York—I have a hunch that I shall be back here again soon as President of the United States.', ""In any case, as your President, I want to say to you—thank you for coming here. I have never spoken from here before—I think it's a pretty good spot. And thanks particularly for the magnificent job you have been doing in this city towards winning the war.""]"
